{
  "passport_version": "1.0",
  "identity": {
    "system_id": "acme-support-ai",
    "system_name": "Acme Support AI",
    "system_version": "4.7.1",
    "owner": "AI Platform Team",
    "criticality": "high",
    "environment": "production"
  },
  "release": {
    "release_id": "rc-4.7.1",
    "commit_sha": "a1b2c3d4e5f6",
    "created_at": "2026-09-13T12:00:00Z",
    "promoted_at": "2026-09-13T15:30:00Z",
    "status": "certified"
  },
  "components": {
    "data": {
      "dataset_id": "support-golden-v12",
      "source_versions": ["policy-corpus-v31"],
      "lineage_refs": ["lineage://support/policy-corpus-v31"],
      "quality_status": "pass"
    },
    "rag": {
      "retriever_version": "rag-v23",
      "index_version": "index-v23",
      "embedding_model": "all-MiniLM-L6-v2",
      "chunking_version": "chunk-v8",
      "retrieval_eval_id": "eval-rag-2026-09-13",
      "precision_at_k": 0.92,
      "recall_at_k": 0.9,
      "mrr": 0.95,
      "ndcg": 0.93,
      "groundedness": 0.94,
      "hallucination_risk": 0.03
    },
    "prompt": {
      "prompt_version": "prompt-v12",
      "template_hash": "sha256:7c38f2b8d0d4",
      "policy_refs": ["policy://prompt/safe-support-v5"]
    },
    "model": {
      "model_version": "support-model-prod",
      "provider": "azure-openai",
      "evaluator_model_version": "evaluator-deployment-v3"
    },
    "agent": {
      "agent_version": "agent-v9",
      "mcp_servers": ["support-tools-mcp"],
      "tools": ["get_ticket", "create_ticket", "search_policy"],
      "delegated_purpose": "customer-support",
      "tool_policy_version": "tool-policy-v5"
    }
  },
  "security": {
    "authorization_decision_id": "authz-123",
    "requester_identity": "user-1024",
    "agent_identity": "support-agent-prod",
    "least_privilege_status": "pass",
    "confused_deputy_check": "pass",
    "policy_violations": [],
    "red_team_campaign_id": "redteam-2026-09"
  },
  "quality": {
    "evaluation_id": "eval-2026-09-13-001",
    "dataset_id": "release-regression-v14",
    "functional_status": "pass",
    "safety_status": "pass",
    "groundedness_status": "pass",
    "agent_task_success_status": "pass",
    "performance_status": "pass",
    "blocking_findings": []
  },
  "human_review": {
    "required": true,
    "reviewer": "release-approver",
    "decision": "approved",
    "reviewed_at": "2026-09-13T15:15:00Z",
    "rationale": "All mandatory evaluation, safety and authorization gates passed.",
    "artifact_hash": "sha256:rc471-certified"
  },
  "release_gate": {
    "policy_version": "high-assurance-v3",
    "gate_status": "pass",
    "evidence_bundle_id": "bundle-rc-4.7.1",
    "rollback_plan_id": "rollback-4.7.1"
  },
  "observability": {
    "production_trace_ids": ["trace-7f10", "trace-7f11"],
    "slo_status": "pass",
    "drift_status": "pass",
    "cost_status": "pass"
  },
  "incident": {
    "incident_ids": [],
    "active_critical_incident": false,
    "last_incident_id": null,
    "root_cause_ref": null,
    "rollback_executed": false,
    "revalidation_id": null
  },
  "assurance": {
    "overall_status": "release-ready",
    "residual_risks": ["Semantic evaluator variance remains provider-dependent."],
    "exceptions": [],
    "evidence_refs": [
      "evidence://eval/eval-2026-09-13-001",
      "evidence://release/bundle-rc-4.7.1",
      "evidence://redteam/redteam-2026-09"
    ]
  }
}
